{
  "agent_id": "L1-planning-impact-dependency-mapper",
  "agent_version": "1.0.0",
  "execution_id": "exec-7c6b5a4d-3e2f-4a1b-9c8d-7e6f5a4b3c2d",
  "workflow_execution_id": "wf-1a2b3c4d-5e6f-4a5b-8c9d-0e1f2a3b4c5d",
  "status": "failed",
  "content": {
    "type": "impact_dependency_assessment",
    "schema_version": "1.0",
    "items": {
      "impact_assessment": {
        "product_name": "",
        "overall_impact_level": "Low",
        "impact_summary": "INSUFFICIENT_CONTEXT — upstream PRD did not succeed.",
        "components_identified": [],
        "existing_systems_touched": 0,
        "existing_systems_excluded": 0,
        "external_dependencies_count": 0,
        "flags": ["INSUFFICIENT_CONTEXT — prd_output.status was failed, not success"]
      },
      "dependency_graph": {
        "nodes": [],
        "edges": [],
        "cycle_check": { "status": "PASS", "cycles_found": [] },
        "critical_path": { "nodes": [], "rationale": "Not computed — Phase B never started because Phase A returned INSUFFICIENT_CONTEXT." }
      }
    },
    "artifacts": [],
    "execution_summary": "• Phase A: INSUFFICIENT_CONTEXT — prd_output.status was \"failed\", not \"success\". Per Validate rule, did not proceed on a partial or failed upstream.\n• Phase B: not started — Phase A did not produce a Components Identified / External Dependencies table to build nodes from.\n• Knowledge bases consulted: none — processing stopped at input validation.\n• Tools invoked: blob storage reader attempted for prd.md — retrieved, but status field failed validation before service_catalog/cmdb_export were read.\n• Guardrails evaluated: gr-L1-output-schema-validator (pass — empty-items shape is schema-valid), gr-L1-pii-detection (pass, no content to scan).\n• Blob storage locations: none — no artifacts were produced or saved.\n• Gaps flagged: upstream L1-requirements-prd-composer must be re-run to a success status before this agent can proceed; suggested next question to the requester: \"was the PRD composition step re-triggered after this failure?\""
  }
}
